{"$schema":"http://json-schema.org/draft-07/schema#","type":"object","required":["name","date_admitted","capital","largest_city","govenor","senators","house_delegation","area","elevation","population","time_zone","latitude","longitude","url","flag_url","insignia_url"],"properties":{"name":{"type":"string"},"date_admitted":{"type":"string"},"capital":{"type":"string"},"largest_city":{"title":"Largest_city","type":"string"},"govenor":{"title":"Govenor","type":"string"},"senators":{"type":"array","representatives":{"type":"string"}},"house_delegation":{"type":"array","representatives":{"type":"string"}},"area":{"type":"object","area_stats":{"type":"string"}},"elevation":{"type":"string","elevation_stats":{"type":"string"}},"population":{"type":"object","items":{"type":"string"}},"time_zone":{"type":"string"},"latitude":{"type":"string"},"longitude":{"type":"string"},"url":{"type":"string"},"flag_url":{"type":"string"},"insignia_url":{"type":"string"}}}
